{
  "ver": 1,
  "iss": "cfmeet.calling",
  "aud": "cfmeet.privacy-relay",
  "runtime_environment": "staging",
  "iat": 1791370800,
  "nbf": 1791370800,
  "exp": 1791370920,
  "jti": "8e1f0c2b3a4d5e6f708192a3b4c5d6e7",
  "request_id": "my-own-id",
  "correlation_id": "corr_0a1b2c3d4e5f60718293a4b5c6d7e8f9"
}
